{
  "$schema": "https://json-schema.org/draft/2020-12/schema",
  "$id": "https://github.com/Wondermove-Inc/clawpod-capabilities/schemas/package-metadata.schema.json",
  "title": "ClawPod Capability Package Metadata",
  "type": "object",
  "additionalProperties": false,
  "required": ["schemaVersion", "version", "description", "compatibility", "safety"],
  "properties": {
    "$schema": {"type": "string", "minLength": 1},
    "schemaVersion": {"const": 1},
    "version": {
      "type": "string",
      "pattern": "^(0|[1-9][0-9]*)\\.(0|[1-9][0-9]*)\\.(0|[1-9][0-9]*)(?:-[0-9A-Za-z.-]+)?$"
    },
    "description": {"type": "string", "minLength": 10, "maxLength": 500},
    "descriptionSource": {"enum": ["package-metadata", "skill-frontmatter"]},
    "descriptionI18n": {
      "description": "Author the Korean translation here; English is generated from the resolved descriptionSource.",
      "type": "object",
      "additionalProperties": false,
      "required": ["ko"],
      "properties": {
        "ko": {"type": "string", "minLength": 10, "maxLength": 500, "pattern": "^\\S(?:[\\s\\S]*\\S)?$"}
      }
    },
    "compatibility": {
      "type": "object",
      "additionalProperties": false,
      "required": ["openclaw"],
      "properties": {
        "openclaw": {"type": "string", "minLength": 1}
      }
    },
    "linkedHarness": {
      "type": "object",
      "additionalProperties": false,
      "required": ["id", "version"],
      "properties": {
        "id": {"type": "string", "pattern": "^[a-z0-9]+(?:-[a-z0-9]+)*$"},
        "version": {"type": "string", "pattern": "^(0|[1-9][0-9]*)\\.(0|[1-9][0-9]*)\\.(0|[1-9][0-9]*)(?:-[0-9A-Za-z.-]+)?$"}
      }
    },
    "safety": {
      "type": "object",
      "additionalProperties": false,
      "required": ["risk", "approvalRequired"],
      "properties": {
        "risk": {
          "enum": ["read-only", "write-safe", "externally-visible", "destructive", "credential-related"]
        },
        "approvalRequired": {"type": "boolean"}
      }
    }
  }
}
