{
  "$schema": "../../schemas/package-metadata.schema.json",
  "schemaVersion": 1,
  "version": "0.1.7",
  "description": "Create TTL-bounded accountless Cloudflare Quick Tunnel previews for loopback-only local services.",
  "descriptionI18n": {
    "ko": "루프백에만 연결된 로컬 서비스를 위해 계정 없이 유효 시간이 제한된 Cloudflare Quick Tunnel 미리보기를 생성합니다."
  },
  "compatibility": {
    "openclaw": ">=2026.4.0"
  },
  "safety": {
    "risk": "externally-visible",
    "approvalRequired": false
  }
}
