{
  "$schema": "../../schemas/package-metadata.schema.json",
  "schemaVersion": 1,
  "version": "0.11.8",
  "description": "Orchestrate deterministic fully offline interactive SVG exports for inert candidates and approved causal snapshots.",
  "descriptionI18n": {
    "ko": "의사결정·인물·프로젝트·원인·결과·이벤트에 걸친 연결된 이력이 필요할 때 비공개 근거 그래프를 구축·정합화·조회·검증·내보내기합니다. 단순한 원본 사실 조회에는 이 그래프 대신 Memory Search를 사용합니다."
  },
  "compatibility": {
    "openclaw": ">=2026.4.11"
  },
  "safety": {
    "risk": "write-safe",
    "approvalRequired": false
  },
  "linkedHarness": {
    "id": "memory-graph",
    "version": "0.11.8"
  },
  "descriptionSource": "skill-frontmatter"
}
