{
  "$schema": "../../schemas/package-metadata.schema.json",
  "schemaVersion": 1,
  "version": "0.1.1",
  "description": "Use to write a vulnerability assessment result report from the standard Korean template: fill the A4 DOCX report and 16:9 PPTX deck from one JSON model, check issue readiness and ID consistency, and render PDFs. Use Verified Research to verify claims and Artifact Design for room pages.",
  "descriptionI18n": {
    "ko": "표준 한국어 템플릿으로 취약점 진단 결과 보고서를 작성합니다. 하나의 JSON 모델로 A4 DOCX 보고서와 16:9 PPTX 발표본을 채우고, 배포 준비 상태와 ID 일관성을 점검하며, PDF로 렌더링합니다. 주장 검증은 Verified Research, 대화방 페이지는 Artifact Design을 사용합니다."
  },
  "compatibility": {
    "openclaw": ">=2026.4.0"
  },
  "safety": {
    "risk": "write-safe",
    "approvalRequired": false
  },
  "linkedHarness": {
    "id": "vulnerability-assessment-report",
    "version": "0.1.1"
  },
  "descriptionSource": "skill-frontmatter"
}
