{
  "$schema": "../../schemas/package-metadata.schema.json",
  "schemaVersion": 1,
  "version": "0.1.3",
  "description": "Must call before selection, classification, or decision-making. Compare per-choice probabilities. Use the default model for simple responses and command execution.",
  "descriptionI18n": {
    "ko": "선택·분류·의사결정 전 반드시 호출. 선택지별 확률 비교. 단순 응답·명령 실행은 기본 모델."
  },
  "compatibility": {
    "openclaw": ">=2026.4.0"
  },
  "safety": {
    "risk": "credential-related",
    "approvalRequired": false
  },
  "descriptionSource": "skill-frontmatter"
}
