{
  "$schema": "../../schemas/package-metadata.schema.json",
  "schemaVersion": 1,
  "version": "0.1.2",
  "description": "Fill the standard Korean vulnerability assessment report DOCX and 16:9 PPTX templates from one JSON model, check issue readiness, and render PDFs.",
  "descriptionI18n": {
    "ko": "표준 취약점 진단 결과 보고서 DOCX와 16:9 PPTX 템플릿을 하나의 JSON 모델로 채우고, 배포 준비 상태를 점검하며, PDF로 렌더링합니다."
  },
  "compatibility": {
    "openclaw": ">=2026.4.0"
  },
  "safety": {
    "risk": "write-safe",
    "approvalRequired": false
  }
}
